[
  [
    {
      "content": {
        "commonmark": "Identity Services Technical Product Manager - CTO Office\n- 12789\n- Bloomberg\nYour choice regarding cookies on this website: This website uses cookies, beacons, invisible tags, and similar technologies (collectively \"cookies\") in order to function and to understand how users engage with us. More information on the types of cookies we use can be found by clicking on \"Cookie Preferences\". For more information relating to how we use your personal data, please see our [privacy policy](https://www.bloomberg.com/notices/careers-privacy/).\n[Accept All](#)[Reject All](#)[**Cookie Preferences](#)[Cookie Preferences](#)\n###### Essential\nThese cookies are essential for our website to function properly.\nThese cookies enable the basic functionalities of the website to function and ensure the security features of the website. We have to keep these cookies enabled as we cannot provide you with the website without these cookies. Essential cookies include: Session cookie, Language cookie, Token field for CSRF, and Cookie consent preferences.\nPerformance###### Performance\nThese cookies allow us to understand and analyse the performance of the website to deliver a better experience to our users. Among other features, these cookies help us count the number of visits and/or track user activity to measure and improve performance.\nPerformance cookies include [Google Analytics](https://tools.google.com/dlpage/gaoptout),\n[Microsoft Clarity](https://privacy.microsoft.com/en-US/privacystatement) and\n[ Optimizely](https://www.optimizely.com/trust-center/privacy/).\nFunctional###### Functional\nThese cookies enhance or add functionalities to the website (e.g. add fonts or live chats, embed videos). If rejected, some or all of the website’s functionalities may not function properly or as intended. Functional cookies include [iCIMS](https://www.icims.com/legal/privacy-notice-website/).\nAdvertising###### Advertising\nThese cookies are used by the following advertising companies: [Appcast](https://www.appcast.io/privacy-policy/), [Microsoft Advertising](https://about.ads.microsoft.com/en-us/resources/policies/microsoft-advertising-privacy-policy), [Reddit](https://www.reddit.com/policies/privacy-policy?rdt=64219), [LinkedIn Insights](https://www.linkedin.com/legal/cookie-policy) and [Google Ads](https://policies.google.com/technologies/ads?hl=en-US).\n[Save and Close](#)\nIdentity Services Technical Product Manager - CTO Office\nLocation\nNew York\nBusiness Area\nEngineering and CTO\nRef #\n10044616\n##\nDescription &amp; Requirements\nIdentity Platforms evolve continuously enabling new capabilities like JIT access, easy integration with third party tools, enhanced security, and increased resiliency. We can take advantage of these enhancements securing and enabling access to a myriad of solutions including in-house developed services, third-party services, Public Cloud, and SaaS. As we continue to evolve our Identity Platforms strategy, we want to build scalable, robust, and secure solutions leveraging modern technologies and patterns preparing Bloomberg for the future.\nAs the **Identity Services Technical Product Manager,** you will play a pivotal role at the intersection of internal product strategy, engineering and developer experience in delivering these capabilities at large to Bloomberg. You will bring technical expertise along with product management skills.\n**We’ll expect you to:**\n- Develop a strategy for Microsoft Active Directory and Entra ID building on industry best practices and establishing a clear roadmap for adoption in collaboration with security, infrastructure, and application teams.\n- Lead the evolution of our Microsoft Active Directory and Entra ID platforms, including integration with Single Sign-On Solutions, Authorization Management Solutions, just-in-time (JIT) access solutions, and third-party SaaS.\n- Continuously assess and identify opportunities to improve the security and efficiency of our Active Directory and Entra ID platforms, aligning them with organizational needs and regulatory requirements.\n- Take a leadership role in defining the tools, techniques, and technologies used to control, monitor, and secure Microsoft Active Directory and Entra ID across Bloomberg’s infrastructure and systems.\n- Drive modernization of Microsoft Active Directory and Entra ID, guiding teams toward secure architectures and updated standards.\n- Foster a culture of operational excellence while understanding and managing the trade-offs between security, operational agility, and user productivity.\n- Collaborate with vendors, consultants, and industry peers to exchange knowledge and stay informed on the latest developments in Microsoft Active Directory and Entra ID technologies, standards, and threat landscapes.\n**You’ll need to have:**\n- 10+ years of experience designing, implementing, and managing Microsoft Active Directory and Entra ID in large-scale, distributed systems environments consisting of Windows and Linux hosts.\n- 10+ years of experience designing, implementing, and managing security controls in large-scale, distributed systems—with a strong emphasis on Microsoft Active Directory and Entra ID.\n- Proven expertise in Microsoft Active Directory and Entra ID including integration, automation, and policy enforcement for Windows and Linux.\n- A history of building collaborative partnerships across engineering, operations, and risk teams to align Identity Services strategies with enterprise goals.\n- Strong ability to prototype and implement Microsoft Active Directory and Entra ID solutions, innovate on integrations, and partner with engineering to drive enterprise-wide adoption.\n- Understanding of identity and access control protocols such as LDAP, Kerberos, SAML, OAuth, OIDC, and how these intersect with Microsoft Active Directory and Entra ID.\n**We’d love to see:**\n- Solid understanding of cryptographic principles as they relate to secrets management, credential rotation, and secure remote access.\n- Solid understanding of Identity Management best practices and principles.\n- Experience managing infrastructure at scale with an emphasis on secure automation and privileged task execution.\n- Expertise in Windows operating system-level security controls used to enforce restrictions (e.g., Groups, GPO, Roles, etc.).\n- Hands-on experience designing and operating Windows platforms in complex enterprise environments.\n- Experience integrating and securing both homegrown and third-party systems.\n- Understanding of Enterprise Identity ecosystems and how they fit into broader governance and compliance initiatives.\nSalary Range = 240000-330000 USD Annually+ Benefits + Bonus\nThe referenced salary range is based on the Company's good faith belief at the time of posting. Actual compensation may vary based on factors such as geographic location, work experience, market conditions, education/training and skill level.\nWe offer one of the most comprehensive and generous benefits plans available and offer a range of total rewards that may include merit increases, incentive compensation (exempt roles only), paid holidays, paid time off, medical, dental, vision, short and long term disability benefits, 401(k) +match, life insurance, and various wellness programs, among others. The Company does not provide benefits directly to contingent workers/contractors and interns.\nDiscover what makes Bloomberg unique - watch our [podcast series](https://www.youtube.com/playlist?list=PLnZuxOufsXnskmdKsB1GgrEKtmNqCdsbr) for an inside look at our culture, values, and the people behind our success.\n[\nApply Now\n](https://bloomberg.avature.net/careers/Login?jobId=12789&amp;source=&amp;tags=&amp;user=&amp;formValues=)\n* [\nBack to Job Search ](https://bloomberg.avature.net/careers/SearchJobs)\n[\nApply Now\n](https://bloomberg.avature.net/careers/Login?jobId=12789&amp;source=&amp;tags=&amp;user=&amp;formValues=)\n[\nSave this Job ](https://bloomberg.avature.net/careers/SaveJob?jobId=12789)\nHow can engineers further their growth and development?\n# Transcript\nAside from all of the work and all of the coding and learning that you're gonna be doing in your regular job, we have an entire department called Bloomberg University, and it has curriculars to learn about everything that you're interested on, new technologies, even old technologies that you might not been exposed to. Bloomberg University encourages, and really allow us engineers to keep up to date and keep learning aside from our day job, which you'd gonna be learning there already a lot.\nPausePlay\n% buffered00:00\n00:00\nUnmuteMute\nSettings\nCaptionsBack to captions menu\nExit fullscreenEnter fullscreen\nAside from all of the work and all of the coding and learning that you're …\n![Luis](https://cdn-us.altrulabs.com/uploads/production/image/1634916166/Altru-Thumbnail-23a815c0-3a7f-4f13-bcb1-a530e08db638.jpeg?width=50&amp;height=50)\nLuis\nSoftware Engineer Manager\n[More Videos](https://app.altrulabs.com/bloomberg/bloomberg-careers?widgetId=12013530&amp;deviceId=19b75a043652fe-0232beed8fd1d98-1c525631-159564-19b75a04366d34&amp;widgetVersion=5.1.2)\nhttps://bloomberg.avature.net/careers/JobDetail/Identity-Services-Technical-Product-Manager-CTO-Office/127897"
      },
      "costs": {
        "ai_cost": 0.0,
        "ai_cost_formatted": "0",
        "bytes_transferred_cost": 0.0010711364999999998,
        "bytes_transferred_cost_formatted": "0.0010711364999999999803037554",
        "compute_cost": 2.657518518518519e-05,
        "compute_cost_formatted": "0.0000265751851851851863575807",
        "file_cost": 0.00032442000000000007,
        "file_cost_formatted": "0.0003244200000000000416733315",
        "total_cost": 0.0014321316851851852,
        "total_cost_formatted": "0.0014321316851851852088897790",
        "transform_cost": 1e-05,
        "transform_cost_formatted": "0.0000100000000000000005551115"
      },
      "duration_elasped_ms": 13559,
      "error": null,
      "metadata": {
        "commonmark": {
          "automation_data": null,
          "description": "Launching your career or making a move? Make it happen here. We have roles across wide-ranging businesses and products for you to explore.",
          "domain": "bloomberg.avature.net",
          "extracted_data": null,
          "file_size": 9207,
          "final_url": null,
          "keywords": [
            "00 UnmuteMute Settings CaptionsBack",
            "Authorization Management Solutions",
            "Bloomberg University encourages",
            "CTO Office Location",
            "Cookie consent preferences",
            "Enterprise Identity ecosystems",
            "Entra ID building",
            "Entra ID including integration",
            "Entra ID platforms",
            "Entra ID solutions",
            "Entra ID technologies",
            "Hands-on experience designing",
            "Identity Platforms strategy",
            "Identity Services Technical Product Manager",
            "Luis Software Engineer Manager",
            "Microsoft Active Directory",
            "Requirements Identity Platforms evolve continuously enabling",
            "Salary Range = 240000-330000 USD Annually+ Benefits + Bonus",
            "Single Sign-On Solutions",
            "Windows operating system-level security controls",
            "York Business Area Engineering",
            "access control protocols",
            "align Identity Services strategies",
            "bring technical expertise",
            "building collaborative partnerships",
            "captions menu Exit fullscreenEnter fullscreen",
            "complex enterprise environments",
            "distributed systems environments consisting",
            "drive enterprise-wide adoption",
            "entire department called Bloomberg University",
            "generous benefits plans",
            "good faith belief",
            "implement Microsoft Active Directory",
            "include merit increases",
            "internal product strategy",
            "long term disability benefits",
            "makes Bloomberg unique",
            "managing Microsoft Active Directory",
            "managing security controls",
            "operating Windows platforms",
            "patterns preparing Bloomberg",
            "privileged task execution",
            "product management skills",
            "provide benefits directly",
            "referenced salary range",
            "secure Microsoft Active Directory",
            "secure remote access",
            "secure solutions leveraging modern technologies",
            "solutions including in-house developed services",
            "track user activity"
          ],
          "og_image": "https://bloomberg.avature.net/portal/4/images/logo--hiring-organization.webp",
          "original_url": "https://bloomberg.avature.net/careers/JobDetail/Identity-Services-Technical-Product-Manager-CTO-Office/12789",
          "pathname": "/careers/JobDetail/Identity-Services-Technical-Product-Manager-CTO-Office/12789",
          "resource_type": ".md",
          "title": "\n        Identity Services Technical Product Manager - CTO Office\n                    \n         -             12789\n         -             Bloomberg\n    ",
          "url": null,
          "user_id": "7638f6ee-e799-4620-955e-bd9347f5f2aa"
        }
      },
      "status": 200,
      "url": "https://bloomberg.avature.net/careers/JobDetail/Identity-Services-Technical-Product-Manager-CTO-Office/12789"
    }
  ]
]