[
  [
    {
      "content": {
        "commonmark": "Team Lead/Product Manager - Employee Engagement Systems\n- 15349\n- Bloomberg\nYour choice regarding cookies on this website: This website uses cookies, beacons, invisible tags, and similar technologies (collectively \"cookies\") in order to function and to understand how users engage with us. More information on the types of cookies we use can be found by clicking on \"Cookie Preferences\". For more information relating to how we use your personal data, please see our [privacy policy](https://www.bloomberg.com/notices/careers-privacy/).\n[Accept All](#)[Reject All](#)[**Cookie Preferences](#)[Cookie Preferences](#)\n###### Essential\nThese cookies are essential for our website to function properly.\nThese cookies enable the basic functionalities of the website to function and ensure the security features of the website. We have to keep these cookies enabled as we cannot provide you with the website without these cookies. Essential cookies include: Session cookie, Language cookie, Token field for CSRF, and Cookie consent preferences.\nPerformance###### Performance\nThese cookies allow us to understand and analyse the performance of the website to deliver a better experience to our users. Among other features, these cookies help us count the number of visits and/or track user activity to measure and improve performance.\nPerformance cookies include [Google Analytics](https://tools.google.com/dlpage/gaoptout),\n[Microsoft Clarity](https://privacy.microsoft.com/en-US/privacystatement) and\n[ Optimizely](https://www.optimizely.com/trust-center/privacy/).\nFunctional###### Functional\nThese cookies enhance or add functionalities to the website (e.g. add fonts or live chats, embed videos). If rejected, some or all of the website’s functionalities may not function properly or as intended. Functional cookies include [iCIMS](https://www.icims.com/legal/privacy-notice-website/).\nAdvertising###### Advertising\nThese cookies are used by the following advertising companies: [Appcast](https://www.appcast.io/privacy-policy/), [Microsoft Advertising](https://about.ads.microsoft.com/en-us/resources/policies/microsoft-advertising-privacy-policy), [Reddit](https://www.reddit.com/policies/privacy-policy?rdt=64219), [LinkedIn Insights](https://www.linkedin.com/legal/cookie-policy) and [Google Ads](https://policies.google.com/technologies/ads?hl=en-US).\n[Save and Close](#)\nTeam Lead/Product Manager - Employee Engagement Systems\nLocation\nNew York\nBusiness Area\nEngineering and CTO\nRef #\n10047175\n##\nDescription &amp; Requirements\n**About Employee Experience at Bloomberg**\nA great employee experience is foundational to our ability to build world-class products and services for our clients. At Bloomberg, our internal platforms reflect our commitment to creating a workplace that is inclusive, informed, and connected. Our employee experience stack supports every Bloomberg employee in doing their best work, both individually and as part of our global community.\nOur mission is to ensure that all employees feel engaged, empowered, and inspired through seamless, intuitive, and impactful platforms that foster collaboration, promote inclusivity, and celebrate our shared values—whether in the office or remote.\nEmployee Engagement Systems is central to our mission, creating and supporting the digital tools that bring Bloomberg employees together, foster our culture, and connect us to the broader world through philanthropy, events, and communication. This includes the tools that power employee inclusion, corporate news and events, and organizational discovery—helping employees understand the people, teams, and structure around them to build meaningful connections and navigate the company with confidence.\n**We’ll Trust You To:**\n* Define the product strategy for employee engagement systems within Bloomberg’s employee experience portfolio.\n* Deliver seamless, intuitive, and user-centric solutions that support inclusion, internal communications, philanthropy, events, and organizational discovery.\n* Translate organizational objectives into digital platform capabilities that connect employees and foster a strong workplace culture.\n* Leverage telemetry, user feedback, and behavioral data to continuously refine the experience and expand the reach of engagement tools.\n* Manage, mentor, and develop a team of product analysts, fostering a collaborative and outcomes-driven environment.\n* Provide direction and clarity across multiple initiatives, setting clear expectations, development goals, and performance feedback.\n* Drive strategic alignment across team members while empowering them to lead with autonomy and purpose.\n* Partner with HR, Internal Communications, and Corporate Philanthropy teams to align platforms with broader strategic goals and initiatives.\n* Engage regularly with senior stakeholders to communicate vision, gather input, and report on platform usage, trends, and outcomes.\n* Lead rollout planning, communications, and change management for key feature launches, ensuring smooth adoption across global offices.\n**You’ll Need to Have:**\n* 6+ years of product management or technical program management experience, including 2+ years leading employee-facing platforms or engagement tools.\n* 2+ years of people management experience with a proven ability to lead, coach, and grow product-focused teams.\n* Deep understanding of content management systems, engagement analytics, personalization, and platform adoption strategies.\n* Experience working in large-scale enterprise environments.\n* Excellent stakeholder collaboration and communication skills.\n* Bachelor's degree in Computer Science, Engineering, Information Systems, or equivalent.\n**We’d Love to See:**\n* Experience with employee intranet or communication tools such as Staffbase, Poppulo, or building custom engagement platforms.\n* Familiarity with design, journey mapping, and employee feedback cycles.\n* Success driving product decisions with data from telemetry, hypothesis validation, and user feedback loops.\nSalary Range = 180000-350000 USD Annually+ Benefits + Bonus\nThe referenced salary range is based on the Company's good faith belief at the time of posting. Actual compensation may vary based on factors such as geographic location, work experience, market conditions, education/training and skill level.\nWe offer one of the most comprehensive and generous benefits plans available and offer a range of total rewards that may include merit increases, incentive compensation (exempt roles only), paid holidays, paid time off, medical, dental, vision, short and long term disability benefits, 401(k) +match, life insurance, and various wellness programs, among others. The Company does not provide benefits directly to contingent workers/contractors and interns.\nDiscover what makes Bloomberg unique - watch our [podcast series](https://www.youtube.com/playlist?list=PLnZuxOufsXnskmdKsB1GgrEKtmNqCdsbr) for an inside look at our culture, values, and the people behind our success.\n[\nApply Now\n](https://bloomberg.avature.net/careers/Login?jobId=15349&amp;source=&amp;tags=&amp;user=&amp;formValues=)\n* [\nBack to Job Search ](https://bloomberg.avature.net/careers/SearchJobs)\n[\nApply Now\n](https://bloomberg.avature.net/careers/Login?jobId=15349&amp;source=&amp;tags=&amp;user=&amp;formValues=)\n[\nSave this Job ](https://bloomberg.avature.net/careers/SaveJob?jobId=15349)\nHow do Bloomberg Communities help you build your network?\n# Transcript\nBeing a part of Bloomberg communities is a great way to build your network. You can attend many different events, discussions, participate in many different chats. This way, you can meet people from all over the world. You can meet people from different countries, different cultures, different departments. This helps when you want to discuss some ideas you have, or introduce new event type, or just generally expand your network and grow your career.\nPausePlay\n% buffered00:00\n00:00\nUnmuteMute\nSettings\nCaptionsBack to captions menu\nExit fullscreenEnter fullscreen\nBeing a part of Bloomberg communities is a great way to build your network. …\n![Eliza](https://cdn-us.altrulabs.com/uploads/production/image/1634548123/Altru-Thumbnail-0-6FF45E49-8750-4D02-A720-D8434880FEC8.jpeg?width=50&amp;height=50)\nEliza\nSoftware Engineer\n[More Videos](https://app.altrulabs.com/bloomberg/bloomberg-careers?widgetId=12013530&amp;deviceId=19b75822f32580-0d8abb0de9ef91-1c525631-1506cf-19b75822f33d08&amp;widgetVersion=5.1.2)\n##\nSimilar jobs\n* [\nTeam Lead/Product Manager - Workplace Security &amp; Safety\n](https://bloomberg.avature.net/careers/JobDetail/Team-Lead-Product-Manager-Workplace-Security-Safety/14551)\nhttps://bloomberg.avature.net/careers/JobDetail/Team-Lead-Product-Manager-Employee-Engagement-Systems/153498"
      },
      "costs": {
        "ai_cost": 0.0,
        "ai_cost_formatted": "0",
        "bytes_transferred_cost": 0.0010690215,
        "bytes_transferred_cost_formatted": "0.0010690214999999999800905925",
        "compute_cost": 2.2661314814814817e-05,
        "compute_cost_formatted": "0.0000226613148148148148873494",
        "file_cost": 0.0003270765,
        "file_cost_formatted": "0.0003270764999999999922408733",
        "total_cost": 0.001428759314814815,
        "total_cost_formatted": "0.0014287593148148147877739268",
        "transform_cost": 1e-05,
        "transform_cost_formatted": "0.0000100000000000000005551115"
      },
      "duration_elasped_ms": 11191,
      "error": null,
      "metadata": {
        "commonmark": {
          "automation_data": null,
          "description": "Launching your career or making a move? Make it happen here. We have roles across wide-ranging businesses and products for you to explore.",
          "domain": "bloomberg.avature.net",
          "extracted_data": null,
          "file_size": 8779,
          "final_url": null,
          "keywords": [
            "00 UnmuteMute Settings CaptionsBack",
            "Cookie consent preferences",
            "Corporate Philanthropy teams",
            "Drive strategic alignment",
            "Eliza Software Engineer",
            "Employee Engagement Systems",
            "Employee Engagement Systems Location",
            "Excellent stakeholder collaboration",
            "Lead rollout planning",
            "Salary Range = 180000-350000 USD Annually+ Benefits + Bonus",
            "Success driving product decisions",
            "Translate organizational objectives",
            "York Business Area Engineering",
            "bring Bloomberg employees",
            "broader strategic goals",
            "build meaningful connections",
            "build world-class products",
            "building custom engagement platforms",
            "captions menu Exit fullscreenEnter fullscreen",
            "content management systems",
            "digital platform capabilities",
            "employee engagement systems",
            "employee experience portfolio",
            "employee experience stack supports",
            "employee feedback cycles",
            "employees feel engaged",
            "ensuring smooth adoption",
            "generous benefits plans",
            "good faith belief",
            "great employee experience",
            "grow product-focused teams",
            "helping employees understand",
            "include merit increases",
            "including 2+ years leading employee-facing platforms",
            "internal platforms reflect",
            "key feature launches",
            "large-scale enterprise environments",
            "long term disability benefits",
            "makes Bloomberg unique",
            "people management experience",
            "platform adoption strategies",
            "power employee inclusion",
            "provide benefits directly",
            "referenced salary range",
            "setting clear expectations",
            "technical program management experience",
            "track user activity",
            "user feedback loops"
          ],
          "og_image": "https://bloomberg.avature.net/portal/4/images/logo--hiring-organization.webp",
          "original_url": "https://bloomberg.avature.net/careers/JobDetail/Team-Lead-Product-Manager-Employee-Engagement-Systems/15349",
          "pathname": "/careers/JobDetail/Team-Lead-Product-Manager-Employee-Engagement-Systems/15349",
          "resource_type": ".md",
          "title": "\n        Team Lead/Product Manager - Employee Engagement Systems\n                    \n         -             15349\n         -             Bloomberg\n    ",
          "url": null,
          "user_id": "7638f6ee-e799-4620-955e-bd9347f5f2aa"
        }
      },
      "status": 200,
      "url": "https://bloomberg.avature.net/careers/JobDetail/Team-Lead-Product-Manager-Employee-Engagement-Systems/15349"
    }
  ]
]