[
  [
    {
      "content": {
        "commonmark": "Technical Product Manager - GenAI Data Discovery &amp; Governance Platform - CTO Office\n- 16054\n- Bloomberg\nYour choice regarding cookies on this website: This website uses cookies, beacons, invisible tags, and similar technologies (collectively \"cookies\") in order to function and to understand how users engage with us. More information on the types of cookies we use can be found by clicking on \"Cookie Preferences\". For more information relating to how we use your personal data, please see our [privacy policy](https://www.bloomberg.com/notices/careers-privacy/).\n[Accept All](#)[Reject All](#)[**Cookie Preferences](#)[Cookie Preferences](#)\n###### Essential\nThese cookies are essential for our website to function properly.\nThese cookies enable the basic functionalities of the website to function and ensure the security features of the website. We have to keep these cookies enabled as we cannot provide you with the website without these cookies. Essential cookies include: Session cookie, Language cookie, Token field for CSRF, and Cookie consent preferences.\nPerformance###### Performance\nThese cookies allow us to understand and analyse the performance of the website to deliver a better experience to our users. Among other features, these cookies help us count the number of visits and/or track user activity to measure and improve performance.\nPerformance cookies include [Google Analytics](https://tools.google.com/dlpage/gaoptout),\n[Microsoft Clarity](https://privacy.microsoft.com/en-US/privacystatement) and\n[ Optimizely](https://www.optimizely.com/trust-center/privacy/).\nFunctional###### Functional\nThese cookies enhance or add functionalities to the website (e.g. add fonts or live chats, embed videos). If rejected, some or all of the website’s functionalities may not function properly or as intended. Functional cookies include [iCIMS](https://www.icims.com/legal/privacy-notice-website/).\nAdvertising###### Advertising\nThese cookies are used by the following advertising companies: [Appcast](https://www.appcast.io/privacy-policy/), [Microsoft Advertising](https://about.ads.microsoft.com/en-us/resources/policies/microsoft-advertising-privacy-policy), [Reddit](https://www.reddit.com/policies/privacy-policy?rdt=64219), [LinkedIn Insights](https://www.linkedin.com/legal/cookie-policy) and [Google Ads](https://policies.google.com/technologies/ads?hl=en-US).\n[Save and Close](#)\nTechnical Product Manager - GenAI Data Discovery &amp; Governance Platform - CTO Office\nLocation\nNew York\nBusiness Area\nEngineering and CTO\nRef #\n10047879\n##\nDescription &amp; Requirements\n#\nBloomberg’s CTO Office is the future-looking technical and product arm of Bloomberg L.P. We envision, design, and prototype the next generation of infrastructure, hardware, and applications that power the Bloomberg Terminal and beyond. Our work spans AI and ML platforms, cloud infrastructure, open-source stewardship, and generative AI innovation.\nFor over a decade, Bloomberg has been at the forefront of applying AI, ML, and NLP to financial intelligence, powering products in sentiment analysis, classification, document understanding, recommendation, and generative AI. Behind these innovations lies a vast ecosystem of data and compute platforms. We are now building new cloud-native capabilities to accelerate AI development across the company and enable the next generation of intelligent products.\n### What’s In It For You\n#\nWe are looking for a Technical Product Manager to define and execute the strategy for Bloomberg’s AI Data Discovery &amp; Governance Platform, a cloud-native foundation for AI data management and lifecycle visibility.\nYou will design and deliver modern data capabilities purpose-built for AI, focused on making data discoverable, accessible, and trackable from curation and training through evaluation and inference.\nYour mission is to connect Bloomberg’s rich data ecosystem to our AI compute environment in the cloud. This includes linking dataset registries, feature platforms, and evaluation datasets to training pipelines, notebooks, and inference systems. The platform you help build will power data discovery, governance, and transparency across Bloomberg’s AI community, enabling faster innovation and greater trust in AI data.\n### Why This Matters\n#\nThis platform will serve as the backbone of Bloomberg’s AI data strategy, ensuring that teams can efficiently develop and operate AI systems with clarity, traceability, and compliance. You will work closely with engineering, infrastructure, and data platform teams across the company to build capabilities that extend Bloomberg’s existing strengths while introducing new systems optimized for AI in the cloud.\nYour impact will span the entire AI lifecycle, helping data scientists and engineers discover, understand, and manage AI data with the same rigor and reliability that define Bloomberg’s broader data ecosystem.\n### We’ll trust you to\n* Define and own the vision for Bloomberg’s AI Data Discovery &amp; Governance Platform, built for AI data workflows in the cloud.\n* Design for the AI lifecycle by building APIs and interfaces that make datasets easy to find, version, and use across training, evaluation, and inference.\n* Develop governance capabilities that ensure responsible use of AI data, with lineage, compliance, and auditing built in from the start.\n* Partner with engineering to deliver scalable systems for metadata management, access control, and lifecycle tracking.\n* Collaborate across Bloomberg’s AI ecosystem to integrate data and compute capabilities that support experimentation and production deployment.\n* Shape the developer experience by defining metadata models, access patterns, and discovery tools that make AI data workflows intuitive.\n* Drive the roadmap for how Bloomberg builds, governs, and scales AI data in the cloud, aligning technology direction with business priorities.\n### You’ll Need to Have\n* 5+ years of experience in technical product management, ideally within AI/ML platforms, data infrastructure, or developer platforms.\n* Hands-on experience building or scaling AI data systems, feature stores, data catalogs, or MLOps infrastructure.\n* Familiarity with cloud-native architectures, distributed systems, Kubernetes, and modern data platform technologies.\n* A strong understanding of AI development workflows, from experimentation to model training, evaluation, and deployment.\n* Proven ability to work cross-functionally with engineering, research, and platform teams to deliver technical products at scale.\n* Excellent communication and storytelling skills, with the ability to articulate a technical vision and influence across diverse teams.\n### We’d Love to See\n* A degree in Computer Science, Engineering, Data Science, or equivalent experience.\n* Experience with LLMs, generative AI, or evaluation dataset frameworks.\n* Experience designing cloud-based data architectures or managing hybrid workloads.\n* Familiarity with data governance, catalogs, or metadata management systems.\n* Contributions to or experience with open-source data and AI infrastructure projects.\n### Why Join Us\n#\nYou will play a pivotal role in shaping Bloomberg’s AI data future by building the platform that enables discoverability, governance, and lifecycle insight across all AI initiatives. This is an opportunity to help define how Bloomberg’s vast data resources are harnessed for AI responsibly, efficiently, and at global scale.\nYou will work alongside world-class engineers, researchers, and product leaders, driving an ambitious agenda to make AI at Bloomberg faster, safer, and more impactful.\n#\n#\n#\n#\n#\nSalary Range = 140000-295000 USD Annually+ Benefits + Bonus\nThe referenced salary range is based on the Company's good faith belief at the time of posting. Actual compensation may vary based on factors such as geographic location, work experience, market conditions, education/training and skill level.\nWe offer one of the most comprehensive and generous benefits plans available and offer a range of total rewards that may include merit increases, incentive compensation (exempt roles only), paid holidays, paid time off, medical, dental, vision, short and long term disability benefits, 401(k) +match, life insurance, and various wellness programs, among others. The Company does not provide benefits directly to contingent workers/contractors and interns.\nDiscover what makes Bloomberg unique - watch our [podcast series](https://www.youtube.com/playlist?list=PLnZuxOufsXnskmdKsB1GgrEKtmNqCdsbr) for an inside look at our culture, values, and the people behind our success.\n[\nApply Now\n](https://bloomberg.avature.net/careers/Login?jobId=16054&amp;source=&amp;tags=&amp;user=&amp;formValues=)\n* [\nBack to Job Search ](https://bloomberg.avature.net/careers/SearchJobs)\n[\nApply Now\n](https://bloomberg.avature.net/careers/Login?jobId=16054&amp;source=&amp;tags=&amp;user=&amp;formValues=)\n[\nSave this Job ](https://bloomberg.avature.net/careers/SaveJob?jobId=16054)\nHow do Bloomberg Communities help you build your network?\n# Transcript\nBeing a part of Bloomberg communities is a great way to build your network. You can attend many different events, discussions, participate in many different chats. This way, you can meet people from all over the world. You can meet people from different countries, different cultures, different departments. This helps when you want to discuss some ideas you have, or introduce new event type, or just generally expand your network and grow your career.\nPausePlay\n% buffered00:00\n00:00\nUnmuteMute\nSettings\nCaptionsBack to captions menu\nExit fullscreenEnter fullscreen\nBeing a part of Bloomberg communities is a great way to build your network. …\n![Eliza](https://cdn-us.altrulabs.com/uploads/production/image/1634548123/Altru-Thumbnail-0-6FF45E49-8750-4D02-A720-D8434880FEC8.jpeg?width=50&amp;height=50)\nEliza\nSoftware Engineer\n[More Videos](https://app.altrulabs.com/bloomberg/bloomberg-careers?widgetId=12013530&amp;deviceId=19b75a2e303b7d-077a22532a1d018-1c525631-f8cfa-19b75a2e304d0b&amp;widgetVersion=5.1.2)\n##\nSimilar jobs\n* [\nTechnical Product Manager - Terminal Application Architecture - CTO Office\n](https://bloomberg.avature.net/careers/JobDetail/Technical-Product-Manager-Terminal-Application-Architecture-CTO-Office/15988)\n* [\nProduct Manager - AV\n](https://bloomberg.avature.net/careers/JobDetail/Product-Manager-AV/14435)\n* [\nProduct Manager - End User Computing\n](https://bloomberg.avature.net/careers/JobDetail/Product-Manager-End-User-Computing/14399)\n* [\nTechnical Product Manager - Metadata Platform Infrastructure\n](https://bloomberg.avature.net/careers/JobDetail/Technical-Product-Manager-Metadata-Platform-Infrastructure/13961)\n* [\nTechnical Product Manager - Semantic Modeling and Integration\n](https://bloomberg.avature.net/careers/JobDetail/Technical-Product-Manager-Semantic-Modeling-and-Integration/13964)\nhttps://bloomberg.avature.net/careers/JobDetail/Technical-Product-Manager-GenAI-Data-Discovery-Governance-Platform-CTO-Office/160545"
      },
      "costs": {
        "ai_cost": 0.0,
        "ai_cost_formatted": "0",
        "bytes_transferred_cost": 0.0010560825,
        "bytes_transferred_cost_formatted": "0.0010560824999999999462829692",
        "compute_cost": 2.6761703703703703e-05,
        "compute_cost_formatted": "0.0000267617037037037028125647",
        "file_cost": 0.0003420930000000001,
        "file_cost_formatted": "0.0003420930000000000470450345",
        "total_cost": 0.0014349372037037037,
        "total_cost_formatted": "0.0014349372037037036966956799",
        "transform_cost": 1e-05,
        "transform_cost_formatted": "0.0000100000000000000005551115"
      },
      "duration_elasped_ms": 13542,
      "error": null,
      "metadata": {
        "commonmark": {
          "automation_data": null,
          "description": "Launching your career or making a move? Make it happen here. We have roles across wide-ranging businesses and products for you to explore.",
          "domain": "bloomberg.avature.net",
          "extracted_data": null,
          "file_size": 11076,
          "final_url": null,
          "keywords": [
            "00 UnmuteMute Settings CaptionsBack",
            "AI Data Discovery",
            "AI compute environment",
            "AI data future",
            "AI data management",
            "AI data strategy",
            "AI data workflows",
            "AI development workflows",
            "AI infrastructure projects",
            "CTO Office Location",
            "Cookie consent preferences",
            "Develop governance capabilities",
            "Eliza Software Engineer",
            "End User Computing",
            "Experience designing cloud-based data architectures",
            "GenAI Data Discovery",
            "Metadata Platform Infrastructure",
            "Salary Range = 140000-295000 USD Annually+ Benefits + Bonus",
            "Technical Product Manager",
            "Terminal Application Architecture",
            "York Business Area Engineering",
            "accelerate AI development",
            "aligning technology direction",
            "broader data ecosystem",
            "captions menu Exit fullscreenEnter fullscreen",
            "defining metadata models",
            "deliver modern data capabilities purpose-built",
            "deliver scalable systems",
            "deliver technical products",
            "enabling faster innovation",
            "entire AI lifecycle",
            "evaluation dataset frameworks",
            "generative AI innovation",
            "generous benefits plans",
            "good faith belief",
            "helping data scientists",
            "include merit increases",
            "includes linking dataset registries",
            "long term disability benefits",
            "make AI data workflows intuitive",
            "make datasets easy",
            "makes Bloomberg unique",
            "making data discoverable",
            "manage AI data",
            "managing hybrid workloads",
            "metadata management systems",
            "modern data platform technologies",
            "operate AI systems",
            "power data discovery",
            "provide benefits directly",
            "referenced salary range",
            "rich data ecosystem",
            "scales AI data",
            "scaling AI data systems",
            "technical product management",
            "track user activity",
            "vast data resources",
            "work alongside world-class engineers",
            "work spans AI"
          ],
          "og_image": "https://bloomberg.avature.net/portal/4/images/logo--hiring-organization.webp",
          "original_url": "https://bloomberg.avature.net/careers/JobDetail/Technical-Product-Manager-GenAI-Data-Discovery-Governance-Platform-CTO-Office/16054",
          "pathname": "/careers/JobDetail/Technical-Product-Manager-GenAI-Data-Discovery-Governance-Platform-CTO-Office/16054",
          "resource_type": ".md",
          "title": "\n        Technical Product Manager - GenAI Data Discovery &amp; Governance Platform - CTO Office\n                    \n         -             16054\n         -             Bloomberg\n    ",
          "url": null,
          "user_id": "7638f6ee-e799-4620-955e-bd9347f5f2aa"
        }
      },
      "status": 200,
      "url": "https://bloomberg.avature.net/careers/JobDetail/Technical-Product-Manager-GenAI-Data-Discovery-Governance-Platform-CTO-Office/16054"
    }
  ]
]