[
  [
    {
      "content": {
        "commonmark": "Infrastructure Automation Engineer\n- 14484\n- Bloomberg\nYour choice regarding cookies on this website: This website uses cookies, beacons, invisible tags, and similar technologies (collectively \"cookies\") in order to function and to understand how users engage with us. More information on the types of cookies we use can be found by clicking on \"Cookie Preferences\". For more information relating to how we use your personal data, please see our [privacy policy](https://www.bloomberg.com/notices/careers-privacy/).\n[Accept All](#)[Reject All](#)[**Cookie Preferences](#)[Cookie Preferences](#)\n###### Essential\nThese cookies are essential for our website to function properly.\nThese cookies enable the basic functionalities of the website to function and ensure the security features of the website. We have to keep these cookies enabled as we cannot provide you with the website without these cookies. Essential cookies include: Session cookie, Language cookie, Token field for CSRF, and Cookie consent preferences.\nPerformance###### Performance\nThese cookies allow us to understand and analyse the performance of the website to deliver a better experience to our users. Among other features, these cookies help us count the number of visits and/or track user activity to measure and improve performance.\nPerformance cookies include [Google Analytics](https://tools.google.com/dlpage/gaoptout),\n[Microsoft Clarity](https://privacy.microsoft.com/en-US/privacystatement) and\n[ Optimizely](https://www.optimizely.com/trust-center/privacy/).\nFunctional###### Functional\nThese cookies enhance or add functionalities to the website (e.g. add fonts or live chats, embed videos). If rejected, some or all of the website’s functionalities may not function properly or as intended. Functional cookies include [iCIMS](https://www.icims.com/legal/privacy-notice-website/).\nAdvertising###### Advertising\nThese cookies are used by the following advertising companies: [Appcast](https://www.appcast.io/privacy-policy/), [Microsoft Advertising](https://about.ads.microsoft.com/en-us/resources/policies/microsoft-advertising-privacy-policy), [Reddit](https://www.reddit.com/policies/privacy-policy?rdt=64219), [LinkedIn Insights](https://www.linkedin.com/legal/cookie-policy) and [Google Ads](https://policies.google.com/technologies/ads?hl=en-US).\n[Save and Close](#)\nInfrastructure Automation Engineer\nLocation\nNew York\nBusiness Area\nEngineering and CTO\nRef #\n10046310\n##\nDescription &amp; Requirements\nOur Team:\nThe Global Corporate Technology Group is responsible for designing, deploying, and supporting Bloomberg’s enterprise IT systems. This includes our global corporate network plus all hardware, software and enterprise applications used by nearly 21,000 employees in more than 170 state-of-the-art offices around the world. We focus on enterprise solutions, productivity tools, and IT systems integration which helps move all of Bloomberg's businesses forward.\nServer &amp; Storage Engineering team drives the Compute and storage needs for all internal Bloomberg Businesses. The team manages the Storage Infrastructure as well as the Physical &amp; Virtual server needs for Internal Businesses including our Datacenters, Corporate Locations &amp; Remote Offices Worldwide. We Engineer our Infrastructure Systems from an Availability, Capacity &amp; Security perspective which includes KPIs, SLAs and OLAs throughout our environments.\nThe Team is accountable for designing and deployment of multi-site infrastructure utilizing Windows (Server Operating Systems) &amp; virtualization technologies such as vSphere &amp; ESXi. The team engineers &amp; manages SAN &amp; NAS infrastructure across various platforms including EMC (Isilon), NetApp (FAS, AFF), Pure and Brocade switches. In addition the team manages various X86 platforms and converged infrastructure such as HP Servers, Flex Fabric. We maintain the infrastructure using a multitude of tools including OneView, Grafana, Orion, vCenter, LogInsight, NetApp OCUM, Insight IQ and Splunk.\nWe collaborate across not only an information systems group, but also with other internal teams (including Security, RISK and CTO) to improve, secure and implement technologies at the server and storage level.\nThe Role:\nAs an Infrastructure Automation Engineer on the Compute and Storage Engineering team, you will be encouraged to automate the provisioning, deployment, scaling, and monitoring of our compute &amp; storage infrastructure platforms. You will be responsible for implementing innovative technologies, automating workflows, and crafting CI/CD automation pipelines. In this role, you will collaborate with Product Owners, Engineers, Developers, and Operations to find opportunities to improve automation and deployment solutions for the corporate infrastructure environment.\nYou’ll need to have:\n* 4+ years of experience with Python, PowerShell and/or other scripting language\n* A Degree in Computer Science, Engineering, Mathematics, similar field of study or equivalent work experience\n* Experience building tools that automate and integrate with API REST and traditional IT Infrastructure components (virtualization, server, storage)\n* A strong familiarity with Continuous Integration and Continuous Deployment (CI/CD) Pipelines (Jenkins, Kubernetes, etc.)\n* Experience with DevOps methodologies and IaC Automation tools such as Terraform or Puppet\n* Experience with Orchestration technologies such as Ansible or Chef\n* Experience driving full software creation process\nWe'd Love to See:\n* Understanding of Linux internals\n* Good knowledge of network protocols, network administration and network security\n* General experience with relational databases\n* Experience working with GIT or other code repositories\n* Good knowledge of storage protocols, storage administration and storage security\n* Understanding Security fundamentals standard methodologies\n* Experience implementing or working with server virtualization and storage infrastructure\n* Excellent written and verbal communication skills and the ability to work independently\nSalary Range = 130000-225000 USD Annually+ Benefits + Bonus\nThe referenced salary range is based on the Company's good faith belief at the time of posting. Actual compensation may vary based on factors such as geographic location, work experience, market conditions, education/training and skill level.\nWe offer one of the most comprehensive and generous benefits plans available and offer a range of total rewards that may include merit increases, incentive compensation (exempt roles only), paid holidays, paid time off, medical, dental, vision, short and long term disability benefits, 401(k) +match, life insurance, and various wellness programs, among others. The Company does not provide benefits directly to contingent workers/contractors and interns.\nDiscover what makes Bloomberg unique - watch our [podcast series](https://www.youtube.com/playlist?list=PLnZuxOufsXnskmdKsB1GgrEKtmNqCdsbr) for an inside look at our culture, values, and the people behind our success.\n[\nApply Now\n](https://bloomberg.avature.net/careers/Login?jobId=14484&amp;source=&amp;tags=&amp;user=&amp;formValues=)\n* [\nBack to Job Search ](https://bloomberg.avature.net/careers/SearchJobs)\n[\nApply Now\n](https://bloomberg.avature.net/careers/Login?jobId=14484&amp;source=&amp;tags=&amp;user=&amp;formValues=)\n[\nSave this Job ](https://bloomberg.avature.net/careers/SaveJob?jobId=14484)\nHow do Bloomberg Communities help you build your network?\n# Transcript\nBeing a part of Bloomberg communities is a great way to build your network. You can attend many different events, discussions, participate in many different chats. This way, you can meet people from all over the world. You can meet people from different countries, different cultures, different departments. This helps when you want to discuss some ideas you have, or introduce new event type, or just generally expand your network and grow your career.\nPausePlay\n% buffered00:00\n00:00\nUnmuteMute\nSettings\nCaptionsBack to captions menu\nExit fullscreenEnter fullscreen\nBeing a part of Bloomberg communities is a great way to build your network. …\n![Eliza](https://cdn-us.altrulabs.com/uploads/production/image/1634548123/Altru-Thumbnail-0-6FF45E49-8750-4D02-A720-D8434880FEC8.jpeg?width=50&amp;height=50)\nEliza\nSoftware Engineer\n[More Videos](https://app.altrulabs.com/bloomberg/bloomberg-careers?widgetId=12013530&amp;deviceId=19b458492c9bfe-0ac95beb750c82-1c525631-f9d80-19b458492cac99&amp;widgetVersion=5.1.2)\n##\nSimilar jobs\n* [\nActive Directory Windows Engineer\n](https://bloomberg.avature.net/careers/JobDetail/Active-Directory-Windows-Engineer/15923)\n* [\nLow Voltage Design &amp; Infrastructure Specialist\n](https://bloomberg.avature.net/careers/JobDetail/Low-Voltage-Design-Infrastructure-Specialist/15394)\n* [\nWindows Endpoint Automation Engineer\n](https://bloomberg.avature.net/careers/JobDetail/Windows-Endpoint-Automation-Engineer/13641)\nhttps://bloomberg.avature.net/careers/JobDetail/Infrastructure-Automation-Engineer/144846"
      },
      "costs": {
        "ai_cost": 0.0,
        "ai_cost_formatted": "0",
        "bytes_transferred_cost": 0.0010320225000000002,
        "bytes_transferred_cost_formatted": "0.0010320225000000000648014975",
        "compute_cost": 1.3734425925925925e-05,
        "compute_cost_formatted": "0.0000137344259259259252420285",
        "file_cost": 0.0003648585,
        "file_cost_formatted": "0.0003648584999999999745057266",
        "total_cost": 0.0014206154259259261,
        "total_cost_formatted": "0.0014206154259259259651043642",
        "transform_cost": 1e-05,
        "transform_cost_formatted": "0.0000100000000000000005551115"
      },
      "duration_elasped_ms": 5559,
      "error": null,
      "metadata": {
        "commonmark": {
          "automation_data": null,
          "description": "Launching your career or making a move? Make it happen here. We have roles across wide-ranging businesses and products for you to explore.",
          "domain": "bloomberg.avature.net",
          "extracted_data": null,
          "file_size": 9074,
          "final_url": null,
          "keywords": [
            "00 UnmuteMute Settings CaptionsBack",
            "Active Directory Windows Engineer",
            "CD automation pipelines",
            "Cookie consent preferences",
            "Eliza Software Engineer",
            "Experience building tools",
            "Experience driving full software creation process",
            "Global Corporate Technology Group",
            "IaC Automation tools",
            "Infrastructure Automation Engineer",
            "Infrastructure Automation Engineer Location",
            "Internal Businesses including",
            "Low Voltage Design",
            "Remote Offices Worldwide",
            "Server Operating Systems",
            "Storage Engineering team",
            "Storage Engineering team drives",
            "Understanding Security fundamentals standard methodologies",
            "Windows Endpoint Automation Engineer",
            "York Business Area Engineering",
            "captions menu Exit fullscreenEnter fullscreen",
            "corporate infrastructure environment",
            "equivalent work experience",
            "generous benefits plans",
            "global corporate network",
            "good faith belief",
            "implementing innovative technologies",
            "include merit increases",
            "internal Bloomberg Businesses",
            "long term disability benefits",
            "makes Bloomberg unique",
            "multi-site infrastructure utilizing Windows",
            "platforms including EMC",
            "provide benefits directly",
            "referenced salary range",
            "tools including OneView",
            "track user activity",
            "verbal communication skills",
            "work independently Salary Range = 130000-225000 USD Annually+ Benefits + Bonus"
          ],
          "og_image": "https://bloomberg.avature.net/portal/4/images/logo--hiring-organization.webp",
          "original_url": "https://bloomberg.avature.net/careers/JobDetail/Infrastructure-Automation-Engineer/14484",
          "pathname": "/careers/JobDetail/Infrastructure-Automation-Engineer/14484",
          "resource_type": ".md",
          "title": "\n        Infrastructure Automation Engineer\n                    \n         -             14484\n         -             Bloomberg\n    ",
          "url": null,
          "user_id": "7638f6ee-e799-4620-955e-bd9347f5f2aa"
        }
      },
      "status": 200,
      "url": "https://bloomberg.avature.net/careers/JobDetail/Infrastructure-Automation-Engineer/14484"
    }
  ]
]